Type;Nom_Application;DN_LDAP_Source;Attribut_Source;Filtre_LDAP;Use_Case_Cible;Entite_Clean_Archi;Description_Fonctionnelle;Commentaires_Transformation;Statut
Groupe;Admin_I7;cn=I7_Admin,ou=groups,dc=cyu,dc=fr;supannEntiteAffectation;(&(supannEntiteAffectation=I7*)(supannRessourceEtat={COMPTE}A*));CreateGroupUseCase;com.entity.Group;Administrateurs globaux de l'IUT (Code I7). Permet l'accès complet aux outils de gestion I7.;Mapping via SiatelFactory;En cours
Role;Analyste;cn=Analyste,ou=roles,dc=cyu,dc=fr;displayName;(supannRoleEntite=*Analyste*);CreateRoleUseCase;com.entity.Role;Gestion des droits techniques pour les Analystes-Développeurs.;Mapping direct sur le Label;A faire
Groupe;IUT_Staff_Sarcelles;ou=people,dc=cyu,dc=fr;l;(&(supannEntiteAffectation=I7*)(supannRessourceEtat={COMPTE}A*)(l=*Sarcelles*)(|(title=*p*dagogi*)(title=Responsable administrati*)(title=Agent*accueil*)));CreateGroupUseCase;com.entity.Group;Personnel pédagogique et administratif affecté au site de Sarcelles.;Filtre basé sur l'attribut l (Locality);En cours
Groupe;IUT_Staff_Neuville;ou=people,dc=cyu,dc=fr;l;(&(supannEntiteAffectation=I7*)(supannRessourceEtat={COMPTE}A*)(l=*Neuville*)(|(title=*p*dagogi*)(title=Responsable administrati*)(title=Agent*accueil*)));CreateGroupUseCase;com.entity.Group;Personnel pédagogique et administratif du site de Neuville (Saint-Germain).;Filtre basé sur l'attribut l (Locality);A faire
Groupe;IUT_Staff_Argenteuil;ou=people,dc=cyu,dc=fr;multi;(&(supannEntiteAffectation=I7*)(supannRessourceEtat={COMPTE}A*)(|(l=*Argenteuil*)(supannLieuAffectation=*Argenteuil*)(description=*Argenteuil*))(|(title=*p*dagogi*)(title=Responsable administrati*)(title=Agent*accueil*)));CreateGroupUseCase;com.entity.Group;Personnel pédagogique et administratif affecté physiquement au site d'Argenteuil.;Filtre multi-attributs pour plus de robustesse;En cours
Groupe;IUT_Staff_StMartin;ou=people,dc=cyu,dc=fr;l;(&(supannEntiteAffectation=I7*)(supannRessourceEtat={COMPTE}A*)(l=*Martin*)(|(title=*p*dagogi*)(title=Responsable administrati*)(title=Agent*accueil*)));CreateGroupUseCase;com.entity.Group;Équipe administrative et pédagogique affectée au site de Saint-Martin.;Filtre basé sur l'attribut l (Locality);A faire
Groupe;IUT_Staff_MDE;ou=people,dc=cyu,dc=fr;I;(&(supannEntiteAffectation=I7*)(supannRessourceEtat={COMPTE}A*)(I=*Maison*Etudiant*));CreateGroupUseCase;com.entity.Group;Personnel de la Maison des Étudiants (MDE) affecté à l'IUT. Exclut les autres bâtiments de Hirsch.;Utilisation de l'attribut I (Lieu spécifique);En cours
